{
  "status": "example_status",
  "deleted_at": "2024-06-15T12:00:00Z",
  "created_at": "2024-06-15T12:00:00Z",
  "updated_at": "2024-06-15T12:00:00Z",
  "id": "550e8400-e29b-41d4-a716-446655440000",
  "name": "example_m-name",
  "description": "example_iption",
  "administrator": "example_trator",
  "telephone": "example_ephone",
  "vatID": "example_-vatID",
  "hasAgriParcel": [],
  "contactPerson": "example_Person",
  "address": "example_ddress"
}